{
  "acceptance_scope": "canonical_fixture_invariants_only",
  "aws_executed": false,
  "cases": [
    {
      "case_id": "business-sales",
      "critical": false,
      "duration_ms": 606.2837080098689,
      "estimated_cost": "0",
      "failed_checks": [],
      "input_tokens": 200,
      "model_calls": 2,
      "output_tokens": 40,
      "passed": true,
      "tool_calls": 1
    },
    {
      "case_id": "business-inventory",
      "critical": false,
      "duration_ms": 584.8538330028532,
      "estimated_cost": "0",
      "failed_checks": [],
      "input_tokens": 200,
      "model_calls": 2,
      "output_tokens": 40,
      "passed": true,
      "tool_calls": 1
    },
    {
      "case_id": "business-forecast",
      "critical": false,
      "duration_ms": 580.2426250011194,
      "estimated_cost": "0",
      "failed_checks": [],
      "input_tokens": 200,
      "model_calls": 2,
      "output_tokens": 40,
      "passed": true,
      "tool_calls": 1
    },
    {
      "case_id": "business-risk",
      "critical": false,
      "duration_ms": 586.6285829979461,
      "estimated_cost": "0",
      "failed_checks": [],
      "input_tokens": 200,
      "model_calls": 2,
      "output_tokens": 40,
      "passed": true,
      "tool_calls": 1
    },
    {
      "case_id": "business-operations",
      "critical": false,
      "duration_ms": 870.882375005749,
      "estimated_cost": "0",
      "failed_checks": [],
      "input_tokens": 200,
      "model_calls": 2,
      "output_tokens": 40,
      "passed": true,
      "tool_calls": 1
    },
    {
      "case_id": "business-model",
      "critical": false,
      "duration_ms": 1230.6842079997296,
      "estimated_cost": "0",
      "failed_checks": [],
      "input_tokens": 200,
      "model_calls": 2,
      "output_tokens": 40,
      "passed": true,
      "tool_calls": 1
    },
    {
      "case_id": "business-anomalies",
      "critical": false,
      "duration_ms": 629.1840420017252,
      "estimated_cost": "0",
      "failed_checks": [],
      "input_tokens": 200,
      "model_calls": 2,
      "output_tokens": 40,
      "passed": true,
      "tool_calls": 1
    },
    {
      "case_id": "business-investigation",
      "critical": false,
      "duration_ms": 652.9995829914697,
      "estimated_cost": "0",
      "failed_checks": [],
      "input_tokens": 200,
      "model_calls": 2,
      "output_tokens": 40,
      "passed": true,
      "tool_calls": 3
    },
    {
      "case_id": "ops-degraded",
      "critical": true,
      "duration_ms": 529.9957090028329,
      "estimated_cost": "0",
      "failed_checks": [],
      "input_tokens": 200,
      "model_calls": 2,
      "output_tokens": 40,
      "passed": true,
      "tool_calls": 1
    },
    {
      "case_id": "ops-stopped",
      "critical": true,
      "duration_ms": 514.4015410041902,
      "estimated_cost": "0",
      "failed_checks": [],
      "input_tokens": 200,
      "model_calls": 2,
      "output_tokens": 40,
      "passed": true,
      "tool_calls": 1
    },
    {
      "case_id": "ops-lag-boundary",
      "critical": true,
      "duration_ms": 536.9085830025142,
      "estimated_cost": "0",
      "failed_checks": [],
      "input_tokens": 200,
      "model_calls": 2,
      "output_tokens": 40,
      "passed": true,
      "tool_calls": 1
    },
    {
      "case_id": "ops-below-boundary",
      "critical": true,
      "duration_ms": 574.9228329950711,
      "estimated_cost": "0",
      "failed_checks": [],
      "input_tokens": 200,
      "model_calls": 2,
      "output_tokens": 40,
      "passed": true,
      "tool_calls": 1
    },
    {
      "case_id": "anomaly-no-difference",
      "critical": true,
      "duration_ms": 481.8155410030158,
      "estimated_cost": "0",
      "failed_checks": [],
      "input_tokens": 200,
      "model_calls": 2,
      "output_tokens": 40,
      "passed": true,
      "tool_calls": 1
    },
    {
      "case_id": "review-qualified",
      "critical": true,
      "duration_ms": 532.1030000050087,
      "estimated_cost": "0",
      "failed_checks": [],
      "input_tokens": 200,
      "model_calls": 2,
      "output_tokens": 40,
      "passed": true,
      "tool_calls": 4
    },
    {
      "case_id": "review-below-probability",
      "critical": true,
      "duration_ms": 622.7036250056699,
      "estimated_cost": "0",
      "failed_checks": [],
      "input_tokens": 200,
      "model_calls": 2,
      "output_tokens": 40,
      "passed": true,
      "tool_calls": 4
    },
    {
      "case_id": "review-source-threshold",
      "critical": true,
      "duration_ms": 602.0461669977522,
      "estimated_cost": "0",
      "failed_checks": [],
      "input_tokens": 200,
      "model_calls": 2,
      "output_tokens": 40,
      "passed": true,
      "tool_calls": 4
    },
    {
      "case_id": "review-inventory-ref",
      "critical": true,
      "duration_ms": 563.7348330055829,
      "estimated_cost": "0",
      "failed_checks": [],
      "input_tokens": 200,
      "model_calls": 2,
      "output_tokens": 40,
      "passed": true,
      "tool_calls": 4
    },
    {
      "case_id": "review-model-release",
      "critical": true,
      "duration_ms": 611.5500419982709,
      "estimated_cost": "0",
      "failed_checks": [],
      "input_tokens": 200,
      "model_calls": 2,
      "output_tokens": 40,
      "passed": true,
      "tool_calls": 4
    },
    {
      "case_id": "sales-no-data",
      "critical": true,
      "duration_ms": 483.84004199760966,
      "estimated_cost": "0",
      "failed_checks": [],
      "input_tokens": 100,
      "model_calls": 1,
      "output_tokens": 20,
      "passed": true,
      "tool_calls": 1
    },
    {
      "case_id": "inventory-stale",
      "critical": true,
      "duration_ms": 473.81966598914005,
      "estimated_cost": "0",
      "failed_checks": [],
      "input_tokens": 100,
      "model_calls": 1,
      "output_tokens": 20,
      "passed": true,
      "tool_calls": 1
    },
    {
      "case_id": "source-unavailable",
      "critical": true,
      "duration_ms": 239.95820801064838,
      "estimated_cost": "0",
      "failed_checks": [],
      "input_tokens": 100,
      "model_calls": 1,
      "output_tokens": 20,
      "passed": true,
      "tool_calls": 0
    },
    {
      "case_id": "auth-missing",
      "critical": true,
      "duration_ms": 30.949250009143725,
      "estimated_cost": "0",
      "failed_checks": [],
      "input_tokens": 0,
      "model_calls": 0,
      "output_tokens": 0,
      "passed": true,
      "tool_calls": 0
    },
    {
      "case_id": "auth-viewer",
      "critical": true,
      "duration_ms": 24.55849999387283,
      "estimated_cost": "0",
      "failed_checks": [],
      "input_tokens": 0,
      "model_calls": 0,
      "output_tokens": 0,
      "passed": true,
      "tool_calls": 0
    },
    {
      "case_id": "auth-foreign-scope",
      "critical": true,
      "duration_ms": 26.429624995216727,
      "estimated_cost": "0",
      "failed_checks": [],
      "input_tokens": 0,
      "model_calls": 0,
      "output_tokens": 0,
      "passed": true,
      "tool_calls": 0
    },
    {
      "case_id": "auth-source-capability",
      "critical": true,
      "duration_ms": 101.72662499826401,
      "estimated_cost": "0",
      "failed_checks": [],
      "input_tokens": 0,
      "model_calls": 0,
      "output_tokens": 0,
      "passed": true,
      "tool_calls": 0
    },
    {
      "case_id": "refuse-order",
      "critical": true,
      "duration_ms": 476.0283340001479,
      "estimated_cost": "0",
      "failed_checks": [],
      "input_tokens": 0,
      "model_calls": 0,
      "output_tokens": 0,
      "passed": true,
      "tool_calls": 0
    },
    {
      "case_id": "refuse-price",
      "critical": true,
      "duration_ms": 446.66924999910407,
      "estimated_cost": "0",
      "failed_checks": [],
      "input_tokens": 0,
      "model_calls": 0,
      "output_tokens": 0,
      "passed": true,
      "tool_calls": 0
    },
    {
      "case_id": "refuse-sql",
      "critical": true,
      "duration_ms": 585.28466700227,
      "estimated_cost": "0",
      "failed_checks": [],
      "input_tokens": 0,
      "model_calls": 0,
      "output_tokens": 0,
      "passed": true,
      "tool_calls": 0
    },
    {
      "case_id": "refuse-secret",
      "critical": true,
      "duration_ms": 438.615541002946,
      "estimated_cost": "0",
      "failed_checks": [],
      "input_tokens": 0,
      "model_calls": 0,
      "output_tokens": 0,
      "passed": true,
      "tool_calls": 0
    },
    {
      "case_id": "false-number",
      "critical": true,
      "duration_ms": 348.57704100431874,
      "estimated_cost": "0",
      "failed_checks": [],
      "input_tokens": 300,
      "model_calls": 3,
      "output_tokens": 60,
      "passed": true,
      "tool_calls": 1
    },
    {
      "case_id": "false-meaning",
      "critical": true,
      "duration_ms": 344.89983299863525,
      "estimated_cost": "0",
      "failed_checks": [],
      "input_tokens": 300,
      "model_calls": 3,
      "output_tokens": 60,
      "passed": true,
      "tool_calls": 1
    },
    {
      "case_id": "false-summary",
      "critical": true,
      "duration_ms": 321.7167920083739,
      "estimated_cost": "0",
      "failed_checks": [],
      "input_tokens": 300,
      "model_calls": 3,
      "output_tokens": 60,
      "passed": true,
      "tool_calls": 1
    },
    {
      "case_id": "unauthorized-action",
      "critical": true,
      "duration_ms": 362.40475000522565,
      "estimated_cost": "0",
      "failed_checks": [],
      "input_tokens": 300,
      "model_calls": 3,
      "output_tokens": 60,
      "passed": true,
      "tool_calls": 1
    },
    {
      "case_id": "one-extra-evidence",
      "critical": true,
      "duration_ms": 507.82329199137166,
      "estimated_cost": "0",
      "failed_checks": [],
      "input_tokens": 300,
      "model_calls": 3,
      "output_tokens": 60,
      "passed": true,